{
  "schemaVersion": "0.1.0",
  "name": "skill-hub",
  "description": "Agent-neutral reusable skills for Claude Code, OpenClaw, Codex, and other SKILL.md-compatible agents.",
  "categories": {
    "dev": {
      "title": "开发与运维",
      "titleEn": "Development & DevOps",
      "description": "项目脚手架、部署、代码组织、CI/CD、监控运维"
    },
    "office": {
      "title": "办公与数据",
      "titleEn": "Office & Data",
      "description": "Office 文件处理、文档识别制作、数据搜索、HR/财务/运营流程"
    },
    "creative": {
      "title": "创意与媒体",
      "titleEn": "Creative & Media",
      "description": "图片、视频、音频、文章排版、设计发布"
    },
    "product": {
      "title": "产品与设计",
      "titleEn": "Product & Design",
      "description": "UI/UX、PRD、流程图、Figma、产品语义设计"
    }
  },
  "skills": [
    {
      "name": "dev-lifecycle",
      "title": "开发全流程编排",
      "version": "0.1.6",
      "category": "dev",
      "path": "skills/dev/dev-lifecycle",
      "description": "编排 project-init、dev-spec、git-flow、ci-trigger 四个 skill，实现项目级 scaffold → feature 级 spec/code/ci 的可中断恢复开发流程；状态分两层：项目级 .dev-flow/project.json（scaffold phase）与 feature 级 .dev-flow/states/<feature>.json（per-feature 并行，活动指针以当前分支为准同步）；GUI merge 是默认关闭的可选辅助能力。Orchestrate project-level scaffold and feature-level spec/code/ci with two-layer state, per-feature parallel state, branch-authoritative active pointer, and optional GUI merge fallback.",
      "supportedAgents": ["claude-code", "codex", "generic"],
      "sideEffects": ["shell", "filesystem-read", "filesystem-write", "network", "external-service"]
    },
    {
      "name": "project-init",
      "title": "Java 项目脚手架生成器",
      "version": "0.3.0",
      "category": "dev",
      "path": "skills/dev/project-init",
      "description": "把空目录变成可立即 mvn package + 可构建镜像 + 可被 dev-lifecycle 接管的 Java Spring Boot 项目骨架（java-web 传统 Web 服务 / java-mcp Spring AI MCP Server）。采用 template + mixin 独立模板架构，template 不继承、零 exclude，从根上消除 javax/jakarta 版本残留；生成 .dev-flow.yml（含 scaffold 块 + build-credentials）并写入项目级状态 .dev-flow/project.json，作为 dev-lifecycle 协议的第 0 个 cascade 节点（项目级 scaffold 阶段）。可选数据源 mixin（mysql HikariCP / redis redisson 单机 / rocketmq）经 include.{mysql,redis,rocketmq} 表单开关条件加载（默认全启用，n 关闭=零副作用），配置经 ${ENV:本地默认} 注入环境文件；HealthChecker SPI 聚合各数据源诊断到 /health（条件性+隔离+聚合）。Generate a ready-to-build Java Spring Boot scaffold; template+mixin architecture with zero inheritance, optional data-source mixins (mysql/redis/rocketmq) conditionally loaded, HealthChecker SPI aggregating datasource diagnostics, scaffold-phase woven into dev-lifecycle protocol.",
      "supportedAgents": ["claude-code", "codex", "generic"],
      "sideEffects": ["filesystem-read", "filesystem-write", "shell", "network"]
    },
    {
      "name": "dev-spec",
      "title": "开发需求规格化",
      "version": "0.1.4",
      "category": "dev",
      "path": "skills/dev/dev-spec",
      "description": "将需求对话、需求文档、API 文档、本地 PDF/DOCX 和原型图整理为证据化 spec，按业务闭环拆分实施步骤并输出到 docs；intake 确定 feature 后建立活动状态文件与指针。Turn requirement materials into evidence-backed specs with business-slice implementation steps; seeds the active per-feature state on intake.",
      "supportedAgents": ["claude-code", "codex", "generic"],
      "sideEffects": ["filesystem-read", "filesystem-write", "network", "browser"]
    },
    {
      "name": "git-flow",
      "title": "开发分支生命周期管理",
      "version": "0.1.5",
      "category": "dev",
      "path": "skills/dev/git-flow",
      "description": "管理单 feature 分支创建、按业务 step 提交、推送、合并测试分支的完整流程；init-branch 在 per-feature 模式下按功能写状态文件与活动指针，支持多功能并行；GUI merge 默认关闭，开启后检测 IntelliJ IDEA 并可降级文本冲突流程。Manage a single feature branch with per-feature state isolation, optional IntelliJ merge detection and text fallback.",
      "supportedAgents": ["claude-code", "codex", "generic"],
      "sideEffects": ["shell", "filesystem-read", "filesystem-write", "network"]
    },
    {
      "name": "ci-trigger",
      "title": "CI/CD 触发与监控",
      "version": "0.1.4",
      "category": "dev",
      "path": "skills/dev/ci-trigger",
      "description": "触发 Jenkins CI 构建、轮询长流程、拉取失败日志、分析原因、更新 state，并可选发送钉钉通知；状态文件路径由编排器 resolver 解析后以 --state 传入。Trigger Jenkins builds, monitor long-running flows, fetch logs, update state, and optionally notify DingTalk; state path resolved by the orchestrator.",
      "supportedAgents": ["claude-code", "codex", "generic"],
      "sideEffects": ["shell", "network", "external-service"]
    },
    {
      "name": "mafengwo-original-images",
      "title": "马蜂窝游记原图下载",
      "version": "0.1.0",
      "category": "creative",
      "path": "skills/creative/mafengwo-original-images",
      "description": "从马蜂窝图片/游记页面提取原始图片链接，下载原图，并生成链接与文件大小清单。",
      "supportedAgents": ["claude-code", "openclaw", "codex", "generic"],
      "sideEffects": ["network", "filesystem-write", "browser"]
    },
    {
      "name": "diverge-converge",
      "title": "扩散收敛法",
      "version": "0.1.0",
      "category": "creative",
      "path": "skills/creative/diverge-converge",
      "description": "一种与 Agent 共建的思维方法:把不成熟的想法通过先扩散(铺开地图、暴露未知)后收敛(逐个锁定决策),逐步逼近成一份任何智能体都能接手的可实施手稿。领域无关,适用于软件架构、研究选题、商业决策、产品设计、写作等一切开放复杂课题。A thinking-partner method that turns an immature idea into an implementable manuscript through deliberate divergence then convergence; domain-agnostic.",
      "supportedAgents": ["claude-code", "codex", "generic"],
      "sideEffects": ["filesystem-write"]
    },
    {
      "name": "wechat-markdown-publisher",
      "title": "微信公众号 Markdown 发布排版",
      "version": "0.2.4",
      "category": "creative",
      "path": "skills/creative/wechat-markdown-publisher",
      "description": "将 Typora/Markdown 文章转换为微信公众号编辑器可粘贴的多主题富文本，默认使用科技黑 X 风格并支持 H2 自动编号、目录编号、开头引用补写与排序、可选封面图、封面上传失败本地降级、可选本地 PDF、图片公网链接复制提示、预览页和兼容性检查报告。",
      "supportedAgents": ["claude-code", "codex", "generic"],
      "sideEffects": ["network", "filesystem-read", "filesystem-write", "shell", "browser"]
    }
  ]
}
